{
  "schema_version": "artifact.v1",
  "artifact_id": "artifact-789",
  "project_id": "project-123",
  "render_id": "render-456",
  "timeline_version": 1,
  "status": "READY",
  "duration_ms": 29800,
  "aspect_ratio": "9:16",
  "resolution": { "width": 1080, "height": 1920 },
  "size_bytes": 12402311,
  "checksum": "sha256:9f2c1a7b4e5d6c8a0b1e2f3a4d5c6b7a8e9f0a1b2c3d4e5f6a7b8c9d0e1f2a3b",
  "files": {
    "video_key": "tenant=demo/project=project-123/artifacts/artifact=artifact-789/final.mp4",
    "preview_key": "tenant=demo/project=project-123/artifacts/artifact=artifact-789/preview.mp4",
    "thumbnail_key": "tenant=demo/project=project-123/artifacts/artifact=artifact-789/thumbnail.jpg",
    "subtitle_key": "tenant=demo/project=project-123/artifacts/artifact=artifact-789/subtitle.vtt",
    "manifest_key": "tenant=demo/project=project-123/artifacts/artifact=artifact-789/manifest.json"
  },
  "created_at": "2026-07-14T12:30:00Z"
}
